{
  "schema": "kinetic/gym/design-quality-evaluation@0.1",
  "evaluation_id": "dqe-ee9eaf0dc9-v1-human-fallback",
  "case_id": "case-ee9eaf0dc9",
  "variant_id": "V1",
  "rubric_version": "kinetic/rubric@0.1.2",
  "producer": "human",
  "capture_manifest_ref": "runs/case-ee9eaf0dc9/captures/v1/manifest.json",
  "brief_ref": "runs/case-ee9eaf0dc9/planning/v1/variant-brief.json",
  "provenance_refs": [
    "runs/case-ee9eaf0dc9/planning/v1/retrieval-receipt.json",
    "runs/case-ee9eaf0dc9/reference/reference-observation.json"
  ],
  "vision_receipt": null,
  "dimensions": {
    "composition": {
      "status": "NOT_EVALUATED",
      "observations": [],
      "strengths": [],
      "failures": [],
      "severity": "none",
      "confidence": null,
      "evidence_capture_ids": [],
      "producer": "human"
    },
    "typography": {
      "status": "NOT_EVALUATED",
      "observations": [],
      "strengths": [],
      "failures": [],
      "severity": "none",
      "confidence": null,
      "evidence_capture_ids": [],
      "producer": "human"
    },
    "art_direction": {
      "status": "NOT_EVALUATED",
      "observations": [],
      "strengths": [],
      "failures": [],
      "severity": "none",
      "confidence": null,
      "evidence_capture_ids": [],
      "producer": "human"
    },
    "depth": {
      "status": "NOT_EVALUATED",
      "observations": [],
      "strengths": [],
      "failures": [],
      "severity": "none",
      "confidence": null,
      "evidence_capture_ids": [],
      "producer": "human"
    },
    "motion": {
      "status": "NOT_EVALUATED",
      "observations": [],
      "strengths": [],
      "failures": [],
      "severity": "none",
      "confidence": null,
      "evidence_capture_ids": [],
      "producer": "human"
    },
    "interaction": {
      "status": "NOT_EVALUATED",
      "observations": [],
      "strengths": [],
      "failures": [],
      "severity": "none",
      "confidence": null,
      "evidence_capture_ids": [],
      "producer": "human"
    },
    "scroll_story": {
      "status": "NOT_EVALUATED",
      "observations": [],
      "strengths": [],
      "failures": [],
      "severity": "none",
      "confidence": null,
      "evidence_capture_ids": [],
      "producer": "human"
    },
    "originality": {
      "status": "NOT_EVALUATED",
      "observations": [],
      "strengths": [],
      "failures": [],
      "severity": "none",
      "confidence": null,
      "evidence_capture_ids": [],
      "producer": "human"
    },
    "cohesion": {
      "status": "NOT_EVALUATED",
      "observations": [],
      "strengths": [],
      "failures": [],
      "severity": "none",
      "confidence": null,
      "evidence_capture_ids": [],
      "producer": "human"
    },
    "surface_fit": {
      "status": "NOT_EVALUATED",
      "observations": [],
      "strengths": [],
      "failures": [],
      "severity": "none",
      "confidence": null,
      "evidence_capture_ids": [],
      "producer": "human"
    }
  },
  "limitations": [
    "Active runtime model is text-only; the S14-verified vision critic path is unavailable for this evaluation.",
    "Visual quality and taste judgment are deferred to the human V1/V2 review gate; no AI aesthetic claim is recorded here.",
    "Deterministic capture evidence is hash-bound but uninterpreted; technical gates cover only objective and heuristic DOM/performance checks."
  ],
  "advisory_recommendation": "HUMAN_VISUAL_GATE",
  "created_at": "2026-09-01T06:21:23Z"
}